Sheet: Sheet1
B1: PHÒNG GD-ĐT QUẢNG TRẠCH | K1: Vụ Giáo Dục Mầm Non
B2: TRƯỜNG MẦM NON QUẢNG SƠN
D3: BẢNG TỔNG HỢP KHẨU PHẦN DINH DƯỠNG TRONG TUẦN
G5: Từ ngày 12/11/2012 đến ngày 17/11/2012
B6: Loại trẻ: Mẫu giáo
B7: Tổng số trẻ: 255
A8: STT | B8: Thứ | C8: Thứ 2 | D8: Thứ 3 | E8: Thứ 4 | F8: Thứ 5 | G8: Thứ 6 | H8: Thứ 7 | I8: Tổng cộng | J8: Năng lượng (Kcal) | K8: Đạm (g) | M8: Béo (g) | O8: Đường bột (g)
B9: Ngày | C9: 12/11 | D9: 13/11 | E9: 14/11 | F9: 15/11 | G9: 16/11 | H9: 17/11
B10: Tên thực phẩm | K10: ĐV | L10: TV | M10: ĐV | N10: TV
A11: 1 | B11: Bí ngô ( Bí đỏ ) | G11: 20.4 | I11: =SUM(RC[-6]:RC[-1]) -> 21 | J11: 5508 | L11: 61.2 | N11: 0 | O11: 1264.8
A12: 2 | B12: Dầu thảo mộc | G12: 0.918 | I12: =SUM(RC[-6]:RC[-1]) -> 21 | J12: 8234.5 | L12: 0 | N12: 915.2 | O12: 0
A13: 3 | B13: Đậu xanh hạt | G13: 1.632 | I13: =SUM(RC[-6]:RC[-1]) -> 21 | J13: 5373.8 | L13: 374.3 | N13: 38.4 | O13: 849.3
A14: 4 | B14: Đường cát | G14: 0.459 | I14: =SUM(RC[-6]:RC[-1]) -> 21 | J14: 1758 | L14: 5 | N14: 0 | O14: 434.2
A15: 5 | B15: Gạo tẻ máy | G15: 32.895 | I15: =SUM(RC[-6]:RC[-1]) -> 21 | J15: 114377.6 | L15: 2462.5 | N15: 324 | O15: 24690
A16: 6 | B16: Hành củ tươi | G16: 0.765 | I16: =SUM(RC[-6]:RC[-1]) -> 21 | J16: 145.4 | L16: 7.6 | N16: 0 | O16: 27.9
A17: 7 | B17: Hành lá | G17: 0.255 | I17: =SUM(RC[-6]:RC[-1]) -> 21 | J17: 46.9 | L17: 2.7 | N17: 0 | O17: 8.8
A18: 8 | B18: Magi | G18: 0.51 | I18: =SUM(RC[-6]:RC[-1]) -> 21 | J18: 204 | K18: 51 | M18: 0 | O18: 0
A19: 9 | B19: Mỡ lợn nước | G19: 0.612 | I19: =SUM(RC[-6]:RC[-1]) -> 21 | J19: 5673.2 | L19: 0 | N19: 610.2 | O19: 0
A20: 10 | B20: Muối | G20: 0.612 | I20: =SUM(RC[-6]:RC[-1]) -> 21 | J20: 0 | L20: 0 | N20: 0 | O20: 0
A21: 11 | B21: Nước mắm Cá ( đặc biệt) | G21: 1.275 | I21: =SUM(RC[-6]:RC[-1]) -> 21 | J21: 765 | K21: 191.2 | M21: 0 | O21: 0
A22: 12 | B22: Rau má rừng | G22: 8.721 | I22: =SUM(RC[-6]:RC[-1]) -> 21 | J22: 2180.2 | L22: 270.4 | N22: 0 | O22: 270.4
A23: 13 | B23: Than | G23: 21.267 | I23: =SUM(RC[-6]:RC[-1]) -> 21 | J23: 0 | L23: 0 | N23: 0 | O23: 0
A24: 14 | B24: Thịt nạc dăm | G24: 10.965 | I24: =SUM(RC[-6]:RC[-1]) -> 21 | J24: 29386.2 | K24: 1864 | M24: 2423.3 | O24: 0
A25: 15 | B25: Tôm đồng | G25: 1.53 | I25: =SUM(RC[-6]:RC[-1]) -> 21 | J25: 1266.8 | K25: 253.4 | M25: 24.8 | O25: 0
A26: 16 | B26: Trứng vịt | G26: 3.06 | I26: =SUM(RC[-6]:RC[-1]) -> 21 | J26: 5494.2 | K26: 377.9 | M26: 412.8 | O26: 29.1
A27: 17 | B27: Xương lợn loại 1 (30:70) | G27: 7.14 | I27: =SUM(RC[-6]:RC[-1]) -> 21 | J27: 5569.2 | K27: 353.4 | M27: 460.5 | O27: 0
G28: Tổng cộng dưỡng chất: | J28: 185983 | K28: 6274.6 | M28: 5209.2 | O28: 27574.5
G29: Tỉ lệ ĐV / TV (%): | K29: 49.3 | L29: 50.7 | M29: 63.8 | N29: 36.2
G30: Trung bình trong ngày: | J30: 729.3 | K30: 729.3 | M30: 729.3 | O30: 729.3
G31: P:L:G: | K31: 13.8 | M31: 25.7 | O31: 60.5
A32: Thứ hai | C32: Thứ ba | F32: Thứ tư | I32: Thứ năm | L32: Thứ sáu | O32: Thứ bảy
L33: Bữa chính 1:Cơm trắng: Món mặn: Thịt hầm bí đỏ + trứng rán Canh: Rau nấu tôm Bữa chính 2: Bữa phụ:Cháo gạo đậu xanh hầm xương